{
  "id": "base:identity_barcode_disagrees_subtle",
  "type": "forgery_vector",
  "applies_to": {
    "document_types": [
      "*"
    ],
    "requires_field": "barcode"
  },
  "class": "internal_inconsistency",
  "tier": 3,
  "difficulty": 4,
  "detectable_by": [
    "base:barcode_scanner"
  ],
  "transform": {
    "op": "perturb_field",
    "target": "barcode.dob",
    "method": "shift_years",
    "range": [
      2,
      6
    ]
  },
  "tell": {
    "behaviour": "volunteers_information",
    "weight": 0.25
  }
}
