{
  "id": "base:collectible_trimmed_blatant",
  "type": "forgery_vector",
  "applies_to": {
    "document_types": [
      "*"
    ],
    "requires_field": "weight"
  },
  "class": "physical_defect",
  "tier": 2,
  "difficulty": 2,
  "detectable_by": [
    "base:precision_scale"
  ],
  "transform": {
    "op": "resize",
    "target": "card_edges",
    "method": "trim_mm",
    "range": [
      0.2,
      0.6
    ]
  },
  "tell": {
    "behaviour": "rehearsed_line",
    "weight": 0.55
  }
}
