{
  "id": "base:identity_blurred_microprint",
  "type": "forgery_vector",
  "applies_to": {
    "document_types": [
      "*"
    ],
    "requires_feature": "microprint_border"
  },
  "class": "physical_defect",
  "tier": 1,
  "difficulty": 3,
  "detectable_by": [
    "base:loupe"
  ],
  "transform": {
    "op": "degrade_feature",
    "target": "microprint_border",
    "method": "raster_blur"
  },
  "tell": {
    "behaviour": "looks_at_door",
    "weight": 0.3
  }
}
