{
  "id": "base:identity_no_microprint_subtle",
  "type": "forgery_vector",
  "applies_to": {
    "document_types": [
      "*"
    ],
    "requires_feature": "microprint_border"
  },
  "class": "physical_defect",
  "tier": 2,
  "difficulty": 3,
  "detectable_by": [
    "base:loupe"
  ],
  "transform": {
    "op": "remove_feature",
    "target": "microprint_border"
  },
  "tell": {
    "behaviour": "looks_at_door",
    "weight": 0.15
  }
}
