{
  "id": "base:commercial_no_carbon_impression_subtle",
  "type": "forgery_vector",
  "applies_to": {
    "document_types": [
      "*"
    ],
    "requires_feature": "carbon_impression"
  },
  "class": "physical_defect",
  "tier": 2,
  "difficulty": 3,
  "detectable_by": [
    "base:loupe"
  ],
  "transform": {
    "op": "remove_feature",
    "target": "carbon_impression"
  },
  "tell": {
    "behaviour": "volunteers_information",
    "weight": 0.25
  }
}
