{
  "id": "base:identity_no_uv_overlay",
  "type": "forgery_vector",
  "applies_to": {
    "document_types": [
      "*"
    ],
    "requires_feature": "uv_seal"
  },
  "class": "physical_defect",
  "tier": 1,
  "difficulty": 2,
  "detectable_by": [
    "base:uv_torch"
  ],
  "transform": {
    "op": "remove_feature",
    "target": "uv_seal"
  },
  "tell": {
    "behaviour": "volunteers_information",
    "weight": 0.4
  }
}
